{
  "dataset_id": "ians-2026-state-of-ciso",
  "source": {
    "name": "2026 State of the CISO Benchmark Report",
    "publisher": "IANS Research & Artico Search",
    "publication_date": "2026-01-15",
    "url": "https://www.iansresearch.com/resources/ians-state-of-the-ciso-report",
    "doc_id": "ians-state-of-ciso-2026"
  },
  "year": 2026,
  "sample_size": 662,
  "region_coverage": ["us", "global"],
  "license_status": "licensed-fair-use",
  "methodology_notes": "Sixth annual IANS + Artico Search CISO Compensation and Budget Research Study. 662 CISOs across industries and org sizes; data collected April–November 2025. Aggregate findings from the public press release; full report is member-restricted. Grounds the CISO's organizational position and influence.",
  "distributions": [
    {
      "question_category": "ciso_reporting_line",
      "kind": "distribution",
      "distribution": { "reports_into_it": 0.64, "reports_to_business_leader": 0.36 },
      "unit": "percentage",
      "context": "64% of CISOs still report into IT leadership; 36% report to business leaders (CEO, COO, general counsel, or chief risk officer). More senior titles correlate with reporting outside IT."
    },
    {
      "question_category": "ciso_exec_title_large_enterprise",
      "kind": "scalar",
      "value": 0.47,
      "unit": "percentage",
      "delta_yoy": 0.14,
      "context": "Executive-level CISO titles in large enterprises rose from 33% (2023) to 47% (2025) — for the first time the largest share vs VP- or director-level."
    },
    {
      "question_category": "ciso_scope_unmanageable",
      "kind": "scalar",
      "value": 0.50,
      "unit": "percentage",
      "context": "More than half of CISOs say their scope is no longer manageable, even as their executive influence grows — a 'role divided' paradox."
    }
  ]
}
